{
  "manifest_version": 3,
  "meta": {
    "company": "测试公司",
    "code": "002897.SZ",
    "as_of": "2026-09-15T09:00:00+08:00",
    "market_data_as_of": "2026-09-14T15:00:00+08:00",
    "generated_at": "2026-09-15T09:05:32+08:00",
    "current_price": 71.39,
    "shares_billion": 1.9386,
    "market_cap_billion": 138.4,
    "evidence_dir": "evidence"
  },
  "forecast": {
    "中性": [
      { "year": 2026, "revenue_billion": 65.0, "net_profit_billion": 3.2, "eps": 1.65 },
      { "year": 2027, "revenue_billion": 76.0, "net_profit_billion": 4.6, "eps": 2.37 },
      { "year": 2028, "revenue_billion": 86.0, "net_profit_billion": 5.8, "eps": 2.99 }
    ]
  },
  "valuation": {
    "method": "PE",
    "target_year": 2026,
    "linked_metric": "net_profit_billion",
    "linked_value": 3.2,
    "multiple": 35,
    "equity_value_billion": 112.0,
    "price_per_share": 57.8
  },
  "evidence_refs": [
    { "claim_id": "C_FIN_REV_2026H1", "importance": "critical" }
  ],
  "final": {
    "status": "观察",
    "core_invalidation": ["证伪1", "证伪2", "证伪3"]
  }
}
